taskid;task;method;result;needed_time;time_generating;amount_generations;amount_new_opts;question0;question1;question2;question3;question4;question5
190;1;2;My friend and me met at the train station to go for a bike trip. After the train arrive in Bamberg, we followed the channel after a break at a skate park. Along the way, we locked some apples from a tree and had lunch. At Forchheim we both were rather exhausted. The weather was pleasant and I was in great spirits. The weather was great and there were no problems with the train. From Nürnberg we took the train home, just in time to visit the grocery store.;563.6598202227615;8.574191650841385;44;7;1;1;4;1;1;3
191;1;0;A friend and me met at the train station to go to Bamberg for a like trip. We followed along the channel along Forchheim. There we made a short stop for lunch. We arrive in Nürnberg just in time for the earlier train, so I could still go to the grocery store after arrival.;87.88711185613647;0;0;0;4;4;5;4;3;1
192;1;1;A friend and me met at the train station to go for a bike ride. After arrival in Bamberg, we headed towards the town of Forchheim.\n\nThe route took us along a channel and the land was rather flat. It was only after a short distance from Forchheim that we had to take a break. a pleasant afternoon with good weather. In Nürnberg, we got the early train.\n\nWe finally arrived home.;353.4930585459806;5.594725362025201;9;0;1;1;3;1;1;3
193;0;2;I wish you a very happy birthday! Take care and stay healthy. I hope to see you soon again. \n\nP.S. I also want to thank you for the beautiful book!;190.44530397700146;2.111167094670236;11;0;4;1;3;1;1;3
194;0;0;I wish you a very happy birthday! Stay healthy and take care. And best of luck with all the challenges that may lie head!;57.88921255385503;0;0;0;3;4;5;4;3;1
195;0;1;I wish you a very happy birthday! All the best and stay healthy. I hope to see you again soon You will always have my love.;133.9370164605789;2.4025614028796554;4;0;4;2;4;1;1;3
