taskid;task;method;result;needed_time;time_generating;amount_generations;amount_new_opts;question0;question1;question2;question3;question4;question5
320;0;1;Hi my friend. I Wish you a Happy Birthday.\n \nI Hope we can See each other soon.\n\nLong Time No See.\n\nI hope you're doing well and that it is all fine with your Family.\n\nWarmly MARY\n\n;394.77378104813397;3.7033215891569853;6;0;2;2;3;1;2;4
321;0;2;Hello my friend,I want to Wish happy birthday to you. How are you doing today? Its been quite a while since we last spoke, I'm so happy to bei in contact with you.please give a message on whats going on and we can talk.I also would love see you soon. Waiting to hear back from you.Best;275.40863398928195;6.103444927372038;33;4;4;3;4;4;4;4
322;0;0;Hello my friend, I just want to wish you a happy birthday. I hope you are doing good and that we can see each other soon. It has been a while. How is life? Let me know. I really hope to hear from you soon. Greetings to the Family. Warmly, Mary  ;193.22560042236;0;0;0;4;4;5;3;3;3
323;1;1;I really did not think that the weather will be that nice. We had sun all days and the sky was clear. We went out for a walk and I was a little worried because of the rain but then we started going to the hotel where we were staying. I said to my husband, "We are going to take a bath and then we;216.43838422838598;3.6183845372870564;6;0;1;1;1;1;1;5
324;1;2;I did not expect to have sunny weather. The sun was shining all day long and we went out for a walk at the sea. At lunch time we were searching for something to eat and found a restaurant with fish dishes.;267.6937739821151;5.995505427010357;33;0;3;2;4;2;2;4
325;1;0;I did not expect the weather to be that good. The sun was shining all day long, so that we decide to go for a walk at the sea. At lunchtime were searching for a restaurant with fresh fish on their menue card. ;112.96300550177693;0;0;0;4;4;5;3;3;3
